{"schema_version":1,"task_id":"7f1c2a9e-3b4d-4e5f-8a6b-1c2d3e4f5a6b","task_type":"docs","execution_tier":"LOCAL_SMALL","risk":0.05,"confidence":0.91,"blast_radius":"single_file","risk_factors":[],"required_context":["MetricCard"],"required_checks":["lint"],"max_attempts":2,"human_approval_required":false,"decided_by":{"provider":"jev","model":"jev-1"},"actions":{"fix":{"verdict":"allow","reason":"docs class allowed","source":"policy"},"merge":{"verdict":"hold","reason":"soak pending","source":"floor"}}}
